<?xml version='1.0' encoding='utf-8'?>

<!-- ============================================================= -->
<!--                    RecDescent grammar definition DTD          -->
<!-- ============================================================= -->

<!--                    Paragraph Content                          -->
<!--                    Content allowed inside paragraphs          -->
<!ENTITY % paracont    "#PCDATA | xref | link | typeref"             >


<!--                    RecDescent                                 -->
<!--                    RecDescent grammar and documentation
                        definition                                 -->
<!ELEMENT  recdescent-xml (description?, preamb?, postamb?, rules+)  >

<!--                    Preambule                                  -->
<!--                    Code to be inserted before the grammar.    -->
<!ELEMENT  preamb       (#PCDATA)                                    >

<!--                    Postambule                                 -->
<!--                    Code to be inserted after the grammar.     -->
<!ELEMENT  postamb      (#PCDATA)                                    >


<!--                    Rules                                      -->
<!ELEMENT  rules        (rule)*                                      >



<!--                    Rule                                       -->
<!--                    RecDescent grammar rule, its action and,
                        optionally, documentation                  -->
<!ELEMENT  rule        (aliases?, production+, comment?, documentation?) >
<!--         id         rule identificator
             type       rule type (you may categorize your rules
             name       rule/command descriptive name             
             regexp     (optional) formal way to match the command
                        name                                       -->
<!ATTLIST  rule                                                      
             id         ID                                 #REQUIRED
             type       CDATA                              #IMPLIED
             name       CDATA                              #IMPLIED
             regexp     CDATA                              #IMPLIED  >


<!--                    Aliases                                    -->
<!--                    Command name aliases                       -->
<!ELEMENT  aliases      (alias+)                                     >
<!--                    Alias                                      -->
<!--                    Command name alias                         -->
<!ELEMENT  alias        EMPTY                                        >
<!--         regexp     (optional) formal way to match the command
                         name                                      -->
<!ATTLIST  alias
             name       CDATA                              #REQUIRED
             regexp     CDATA                              #IMPLIED  >


<!--                    Production                                 -->
<!--                    The rule production                        -->
<!ELEMENT  production   (selfref | group | regexp | directive | ruleref | literal | action)*    >



<!--                    RegExp                                     -->
<!--                    Token matched by a regular expression      -->
<!ELEMENT  regexp       (#PCDATA)                                    >



<!--                    RecDescent directive                       -->
<!ELEMENT  directive    (#PCDATA)                                    >
<!--         type       Directive type                             -->
<!ATTLIST  directive
             type
                        (commit|uncommit|reject|score|autoscore|skip|resync|error|rulevar|matchrule|leftop|rightop|defer|nocheck|perl_quotelike|perl_codeblock|perl_variable|token)


                                                           #REQUIRED >
<!--                    Sub-Rule                                   -->
<!--                    Ruleref reference                          -->
<!ELEMENT  ruleref      EMPTY                                        >
<!--         rep        repetition suffix                          -->
<!ATTLIST  ruleref
             ref        IDREF                              #REQUIRED
             rep        CDATA                              #IMPLIED  >

<!--                    Literal                                    -->
<!--                    Literal value                              -->
<!ELEMENT  literal      (#PCDATA)                                    >




<!--                    Action                                     -->
<!--                    Perl code which is evaluated on successful
                        production                                 -->
<!ELEMENT  action       (#PCDATA)                                    >



<!--                    Documentation                              -->
<!--                    Rule documentation                         -->
<!ELEMENT  documentation (title?, usage?, description?, see-also?)   >



<!--                    Usage                                      -->
<!--                    Usage description                          -->
<!ELEMENT  usage        (%paracont;)*                                >



<!--                    Description                                -->
<!--                    Command description                        -->
<!ELEMENT  description  (para | code | example)*                     >


<!--                    See-also                                   -->
<!--                    List of related rules/commands             -->
<!ELEMENT  see-also     (ruleref+)                                   >



<!--                    Comment                                    -->
<!--                    A comment                                  -->
<!ELEMENT  comment      (#PCDATA)                                    >


<!--                    Xref                                       -->
<!--                    Automatic cross-reference                  -->
<!ELEMENT  xref         EMPTY                                        >
<!ATTLIST  xref
             linkend    IDREF                              #REQUIRED >

<!--                    TypeRef                                    -->
<!--                    Reference to all rules of a given type     -->
<!ELEMENT  typeref      EMPTY                                        >
<!--         types      space separated list of target types       -->
<!ATTLIST  typeref
             types      CDATA                              #REQUIRED >


<!--                    Link                                       -->
<!--                    Textual cross-reference                    -->
<!ELEMENT  link         (#PCDATA)                                    >
<!ATTLIST  link
             linkend    IDREF                              #REQUIRED >


<!--                    Paragraph                                  -->
<!ELEMENT  para         (%paracont;)*                                >

<!--                    Title                                      -->
<!--                    Rule documentation/example title           -->
<!ELEMENT  title        (#PCDATA)                                    >


<!--                    Group                                      -->
<!--                    Group of alternative productions           -->
<!ELEMENT  group        (production+)                                >


<!--                    SelfRef                                    -->
<!--                    Inserts a production item which is matched
                        by command name or any alias               -->
<!ELEMENT  selfref      EMPTY                                        >


<!--                    Example                                    -->
<!--                    Example in command or rule description     -->
<!ELEMENT  example      (title?,code+)                               >

<!--                    Code                                       -->
<!--                    A block of formatted programming code      -->
<!ELEMENT  code         (#PCDATA)                                    >


<!-- ============================================================= -->
<!--                    End of RecDescent command definition DTD   -->
<!-- ============================================================= -->
